<?xml version="1.0" encoding="utf-8"?>

<main xmlns:xsi="http://www.w3.org/2001/XMLSchema-instance" xsi:noNamespaceSchemaLocation="main.xsd">
	<author>
		<name>Artur</name>
		<surname>Sierakowski</surname>
	</author>

	<section kind="information">
			<art>
				<title>Czym jest sztuka</title>
				<text>
					Nie istnieje powszechnie przyjęta definicja sztuki. Często używamy słowa "sztuka" do opisywania pięknego przedmiotu lub umiejętności pozwalającej wytworzyć przedmiot o wysokich walorach estetycznych. Patrząc w ten sposób, moglibyśmy więc całymi godzinami spierać się o to, czym jest sztuka. I prawdopodobnie mielibyśmy problem z osiągnięciem jakiegoś zadowalającego konsensusu.
					Choć nie ma jednej uniwersalnej definicji sztuki, istnieje ogólna zgoda, że jest ona świadomym działaniem mającym na celu stworzenie czegoś pięknego lub znaczącego (w taki czy inny sposób) przy użyciu wyobraźni oraz umiejętności.
					Warto w tym miejscu zaznaczyć, że postrzeganie sztuki zmieniało się na przestrzeni kolejnych wieków oraz w zależności od kultury, jaką moglibyśmy rozpatrywać. Obraz autorstwa Jean-Michel Basquiat, który sprzedano za 110,5 miliona dolarów na aukcji Sotheby w maju 2017 roku, bez wątpienia nie zostałby uznany za dzieło sztuki na przykład w renesansowych Włoszech.
					Lorem ipsum dolor sit amet, consectetur adipiscing elit. Proin sit amet varius nunc, ut commodo nisi. Nunc hendrerit maximus iaculis. Aenean et erat purus. Nam accumsan orci a ante lacinia gravida. Praesent finibus lectus sit amet sapien pellentesque, ac suscipit tellus pellentesque. Maecenas magna leo, tempor at ligula vel, congue consequat augue. Praesent bibendum lorem iaculis metus aliquet cursus. Ut id feugiat nisl, ac cursus turpis. Pellentesque ultrices enim felis, sed posuere ex luctus quis. Proin in turpis neque. Mauris porta tempor lacinia. Aenean fringilla condimentum lacus sit amet placerat. Nam tincidunt ligula et tempor maximus. Aliquam non massa quis ante suscipit pellentesque vel sit amet odio. Nullam sit amet leo neque. Vivamus lacinia enim felis, hendrerit cursus enim convallis quis.
					Morbi ut sagittis magna, et aliquam magna. Integer pulvinar pulvinar sem lacinia tempus. Nam quis tincidunt libero, eget lacinia felis. Etiam feugiat fringilla auctor. Mauris odio tellus, maximus sit amet elementum a, egestas quis neque. Duis tincidunt scelerisque porttitor. Vivamus dictum nunc eget justo efficitur, condimentum interdum dolor efficitur. Quisque consequat iaculis felis, in tincidunt lorem dictum id. Sed mollis ligula ut mi porttitor pretium sit amet ut nulla. Fusce eget imperdiet turpis. Fusce eget maximus quam.
					Nullam at tortor lobortis, tempus massa a, congue ex. Nulla suscipit tincidunt leo sodales commodo. Sed quis bibendum enim, nec porttitor ex. Curabitur non ornare diam, sed fringilla leo. Phasellus egestas commodo urna in interdum. Suspendisse sit amet euismod dolor, et pharetra odio. Orci varius natoque penatibus et magnis dis parturient montes, nascetur ridiculus mus. Duis semper neque in sapien tristique, ac eleifend nisi accumsan. Proin venenatis turpis at ante tempor pharetra. Fusce faucibus neque at eleifend tincidunt. Vestibulum auctor nulla eget ante mattis ullamcorper.
					Integer condimentum neque non dignissim condimentum. Nulla nec turpis quis felis venenatis dignissim et ut dui. In eget felis augue. Donec finibus dui mi, facilisis posuere libero dignissim non. Nulla consequat malesuada tortor, et tincidunt neque lacinia suscipit. Donec vitae est lorem. Sed blandit, leo quis aliquam blandit, sapien mi tempor orci, et elementum est velit quis orci. Sed malesuada nunc metus, at eleifend dui aliquet ac. Morbi non ornare ante.
					Donec commodo hendrerit posuere. Sed accumsan et sapien nec vestibulum. Pellentesque sit amet facilisis neque. Mauris mollis mi convallis, dignissim ipsum in, laoreet dolor. Nullam eu erat nisi. In vel diam id dolor mollis dignissim vel ut tellus. Pellentesque nec odio dui. Curabitur eget quam ligula. Etiam egestas, nulla eu rhoncus mollis, lacus risus bibendum ipsum, eu posuere velit tortor nec nisi. Pellentesque ut accumsan mi. Donec non nibh tincidunt, fringilla ipsum sit amet, sollicitudin ex.
				</text>
			</art>
			<contact>
				<title>Kontakt</title>
				<text>
					Jeśli chciałbyś zaproponować temat następnej pracy lub nawiązać współpracę zapraszam do kontaktu mailowego na adres blabla@poczta.com.
					Zachęcam również do zapoznania się z poniższymi mediami społecznościowymi, na których umieszczam nowe rysunki oraz tutoriale.
				</text>				
			</contact>
	</section>

	<section kind="content">
			<drawings>
				<title>Moja galeria</title>
				<table id="1">
					<list order="alphabetical">
						<drawing>domin</drawing>
						<drawing>nemo</drawing>
						<drawing>nieskonczony</drawing>
						<drawing>portret</drawing>
						<drawing>rysunek</drawing>			
					</list>
				</table>
			</drawings>
	</section>

	<images>
		<image source="img/main.jpg"></image>
		<image source="img/portret.jpg"></image>
		<image source="img/nieskonczony.jpg"></image>
		<image source="img/domin.jpg"></image>
		<image source="img/rysunek.jpg"></image>
		<image source="img/nemo.jpg"></image>
	</images>

	<media>
		<links>
			<link important="yes" source="https://facebook.com/">Facebook</link>
			<link important="yes" source="https://instagram.com/">Instagram</link>
			<link important="yes" source="https://youtube.com">Youtube</link>
			<link important="yes" source="https://pinterest.com/">Pinterest</link>
		</links>
	</media>
</main>